{
  "request_id": "req-conformance-0001",
  "trace_id": "4bf92f3577b34da6a3ce929d0e0e4736",
  "capability": "chat",
  "authorization_ref": "authz-ref-1",
  "organization_id": "6f1d2c3b-4a5e-4f60-8a7b-9c0d1e2f3a4b",
  "user_id": "2b3c4d5e-6f70-4812-9a3b-4c5d6e7f8091",
  "allowed_tools": [
    {
      "name": "records.search",
      "level": "read"
    },
    {
      "name": "records.draft",
      "level": "propose"
    },
    {
      "name": "records.apply",
      "level": "commit"
    }
  ],
  "deadline": "2030-01-01T00:00:00Z",
  "context_refs": [
    {
      "kind": "document",
      "ref": "doc-1"
    },
    {
      "kind": "record.note",
      "ref": "note-1"
    }
  ],
  "input": {
    "messages": [
      {
        "role": "system",
        "content": "synthetic system instruction"
      },
      {
        "role": "user",
        "content": "synthetic question"
      },
      {
        "role": "assistant",
        "content": "synthetic earlier answer"
      }
    ]
  },
  "group_id": "9a8b7c6d-5e4f-4a3b-9c2d-1e0f9a8b7c6d",
  "business_entity_id": "1a2b3c4d-5e6f-4a7b-8c9d-0e1f2a3b4c5d",
  "callback_grant_ref": "grant-ref-1"
}
