{
  "request_id": "req-conformance-0001",
  "trace_id": "4bf92f3577b34da6a3ce929d0e0e4736",
  "capability": "chat",
  "authorization_ref": "authz-ref-1",
  "organization_id": "6F1D2C3B-4A5E-4F60-8A7B-9C0D1E2F3A4B",
  "user_id": "2B3C4D5E-6F70-4812-9A3B-4C5D6E7F8091",
  "allowed_tools": [],
  "deadline": "2030-01-01T00:00:00Z",
  "context_refs": [],
  "input": {
    "messages": [
      {
        "role": "user",
        "content": "synthetic prompt"
      }
    ]
  },
  "group_id": "9A8B7C6D-5E4F-4A3B-9C2D-1E0F9A8B7C6D"
}
